TieuDe,LinkBaiViet,NoiDung,TuKhoa,NgayPhatHien
Giáo dục - Thông tấn xã Việt Nam (TTXVN),https://vnanet.vn/vi/tin-tuc/giao-duc-5/,"4 days ago ... VietnamPlus | 15/08/2025 20:46. Đại học Cửu Long tặng học bổng toàn phần đầu tiên cho sinh viên Sri Lanka. Trường Đại học Cửu Long ... lừa đảo, trục lợi cá ...",lừa đảo,21:36:48 20/8/2025
"Trẻ bị lừa đảo online, nhà trường đã dạy gì về phòng vệ trên mạng ...",https://baomoi.com/tre-bi-lua-dao-online-nha-truong-da-day-gi-ve-phong-ve-tren-mang-c52961830.epi,"Aug 10, 2025 ... Nhà trường cũng đã triển khai nhưng phải cải tiến hơn nữa, thậm chí còn phải giáo dục ngược lại cha mẹ. ... Trường Đại học Cửu Long trao ...",lừa đảo,21:36:48 20/8/2025
tỷ lệ thủy,https://www.gwcl.ac.in/xsn/08_06_t%E1%BA%A3i_mu88,"Aug 9, 2025 ... ... giảng viên khoa Ngữ văn, Ngoại ngữ Trường Đại học Cửu Long, sau đó chuyển ... gian lận.️. Khi không ăn nho, bé lăn lộn trên sàn hoặc phơi mình dưới cái ...",gian lận,09:43:28 21/8/2025
Đại Học Cửu Long Bị Phốt | TikTok,https://www.tiktok.com/discover/%C4%91%E1%BA%A1i-h%E1%BB%8Dc-c%E1%BB%ADu-long-b%E1%BB%8B-ph%E1%BB%91t,"Aug 10, 2025 ... tuyển sinh Đại Học Cửu Long, hướng nghiệp Đại Học Cửu Long ... Triết lý giáo dục tại Đại Học Cửu Long, giáo dục toàn diện sáng tạo ...",phốt,19:32:48 21/8/2025
Mẫu đơn trình công an bị lừa đảo chiếm đoạt tài sản qua mạng? Tải ...,https://thuvienphapluat.vn/phap-luat/mau-don-trinh-cong-an-bi-lua-dao-chiem-doat-tai-san-qua-mang-tai-mau-don-trinh-bao-bi-lua-dao-o-dau-464984-213359.html,4 days ago ... ... lừa đảo chiếm đoạt tài sản qua mạng đi tù bao nhiêu năm ... Điểm chuẩn Trường Đại học Cửu Long năm 2025 ra sao? Công bố ...,"lừa đảo, chiếm đoạt",15:20:32 23/8/2025
Phốt Đại Học Gia Định | TikTok,https://www.tiktok.com/discover/ph%E1%BB%91t-%C4%91%E1%BA%A1i-h%E1%BB%8Dc-gia-%C4%91%E1%BB%8Bnh,"5 days ago ... Khám phá thông tin tuyển sinh CAND 2025, từ vùng tuyển sinh đến ngành học. ... Đại Học Cửu Long Bị Phốt · Phốt Đại Học Công Nghiệp · Đh Gia Định ...",phốt,15:20:32 23/8/2025
Phốt Đại Học Thăng Long | TikTok,https://www.tiktok.com/discover/ph%E1%BB%91t-%C4%91%E1%BA%A1i-h%E1%BB%8Dc-th%C4%83ng-long,"2 hours ago ... ... tuyển sinh Đại học Thăng Long, sự nghiệp âm nhạc, học trò thanh nhạc ... Đại Học Cửu Long Bị Phốt · Đại Học Hạ Long · Đại Học Thăng Long Có Tốt Không · Đại ...",phốt,17:53:38 25/8/2025
Công an xã Lục Sĩ Thành,https://www.facebook.com/conganxalucsithanh/?locale=vi_VN,"15 hours ago ... ... Đại học Cửu Long tổ chức 06 buổi báo cáo chuyên đề dành cho 3.128 sinh ... lừa đảo, chiếm đoạt tài sản nói riêng. Sự phối hợp nhịp nhàng giữa lực lượng ...","lừa đảo, chiếm đoạt",17:53:38 25/8/2025
Vuihoc Bị Phốt | TikTok,https://www.tiktok.com/discover/vuihoc-b%E1%BB%8B-ph%E1%BB%91t,4 hours ago ... Đại Học Cửu Long Bị Phốt · Phốt Đỗ Huyền Thy Đại Học Văn Lang Với Thầy Cùng ... Khám phá sự kiện bị phốt tại NTTU cùng giảng viên Mr. Nghĩa và những tác ...,phốt,05:00:58 26/8/2025
Trường Đại Học Kinh Doanh Và Công Nghệ Bị Phốt | TikTok,https://www.tiktok.com/discover/tr%C6%B0%E1%BB%9Dng-%C4%91%E1%BA%A1i-h%E1%BB%8Dc-kinh-doanh-v%C3%A0-c%C3%B4ng-ngh%E1%BB%87-b%E1%BB%8B-ph%E1%BB%91t,6 hours ago ... ... giảng viên. #onthi #xuhuong ... Có Duyên Không Nợ (H2O Remix) [Short Version] - H2O Remix · Đỗ Văn Đức Toán Bị Phốt · Đại Học Cửu Long Bị Phốt.,phốt,11:00:58 26/8/2025
Trường Cao Đẳng Công Nghệ Thủ Đức Bị Phốt | TikTok,https://www.tiktok.com/discover/tr%C6%B0%E1%BB%9Dng-cao-%C4%91%E1%BA%B3ng-c%C3%B4ng-ngh%E1%BB%87-th%E1%BB%A7-%C4%91%E1%BB%A9c-b%E1%BB%8B-ph%E1%BB%91t,"6 hours ago ... nhạc nền - Lớp học GenZ · Phốt Đại Học Nguyễn Tất Thành · Đinh Trường Giang Phốt · Đại Học Cửu Long Bị Phốt ... lừa đảo online, phương pháp tránh lừa đảo, lừa đảo ...","lừa đảo, phốt",11:00:58 26/8/2025
Trường Trung Học Cơ Sở Thới Long Cần Thơ | TikTok,https://www.tiktok.com/discover/tr%C6%B0%E1%BB%9Dng-trung-h%E1%BB%8Dc-c%C6%A1-s%E1%BB%9F-th%E1%BB%9Bi-long-c%E1%BA%A7n-th%C6%A1,"10 hours ago ... ... giáo dục tại Việt Nam, trường trung học cơ sở, thông tin giáo dục, trải ... Đại Học Cửu Long Bị Phốt · Kể Chuyện Ma Ở Đại Học Cần Thơ. 698Thích. 5Bình luận.",phốt,16:21:00 26/8/2025
Nhân Viên Kinh Doanh B2B - AI Giáo Dục Ngoại Ngữ (có thể giao ...,https://studentjob.vn/viec-lam/nhan-vien-kinh-doanh-b2b-ai-giao-duc-ngoai-ngu-co-the-giao-tiep-tieng-han-job756720,"2 hours ago ... Báo cáo tin tuyển dụng: Nếu bạn thấy rằng tin tuyển dụng này không đúng hoặc có dấu hiệu lừa đảo, hãy phản ánh với chúng tôi. ... Đại học Cửu Long, Đại học ...",lừa đảo,19:00:44 28/8/2025
Review Đại Học Võ Trường Toản Y Khoa | TikTok,https://www.tiktok.com/discover/review-%C4%91%E1%BA%A1i-h%E1%BB%8Dc-v%C3%B5-tr%C6%B0%E1%BB%9Dng-to%E1%BA%A3n-y-khoa,"4 hours ago ... ... giảng viên tâm huyết, đăng ký xét ... Lê Trọng Đại · Afit University · Eiu University Phốt · Phốt Đại Học Nguyễn Tất Thành · Ct University · Đại Học Cửu Long Bị ...",phốt,19:00:44 1/9/2025
Trường Đại Học Văn Hiến Bị Phốt | TikTok,https://www.tiktok.com/discover/tr%C6%B0%E1%BB%9Dng-%C4%91%E1%BA%A1i-h%E1%BB%8Dc-v%C4%83n-hi%E1%BA%BFn-b%E1%BB%8B-ph%E1%BB%91t,"6 hours ago ... ... Đại Học Cửu Long Bị Phốt, Trường Đại Học Hải Dương Bị Phốt ... gian lận thi cử nên đã báo cáo Trưởng điểm thi kiểm tra, lập biên bản ...","gian lận, phốt",11:00:44 2/9/2025
Bác Sĩ Lê Trọng Đại Bị Phốt | TikTok,https://www.tiktok.com/discover/b%C3%A1c-s%C4%A9-l%C3%AA-tr%E1%BB%8Dng-%C4%91%E1%BA%A1i-b%E1%BB%8B-ph%E1%BB%91t,12 hours ago ... Lê Trọng Đại · Afit University · Eiu University Phốt · Kohat University · Đại Học Cửu Long Bị Phốt ... Việc trở thành Giảng viên một trường ĐH nào đó quá đơn giản ...,phốt,11:00:44 2/9/2025
Nam Vương Văn Lang Dính Phốt | TikTok,https://www.tiktok.com/discover/nam-v%C6%B0%C6%A1ng-v%C4%83n-lang-d%C3%ADnh-ph%E1%BB%91t,2 hours ago ... Phốt Đại Học Mở · Đại Học Cửu Long Bị Phốt · Phốt Sinh Viên Văn Lang · Phốt Đại Học Công Nghiệp · Phốt Đại Học Nguyễn Tất Thành · Lương Giảng Viên Đại Học Văn ...,phốt,11:00:44 2/9/2025
Đại Học Thăng Long Ký Túc Xá | TikTok,https://www.tiktok.com/discover/%C4%91%E1%BA%A1i-h%E1%BB%8Dc-th%C4%83ng-long-k%C3%BD-t%C3%BAc-x%C3%A1,22 hours ago ... Đừng bỏ lỡ cơ hội tuyển sinh và nhận 2k5 muốn vào đại học năm nay! #tlu ... Đại Học Cửu Long Bị Phốt · Ký Túc Xá Đại Học Nguyễn Tất Thành Quận 12 · Review ...,phốt,03:00:44 3/9/2025
Thpt Mạc Đĩnh Chi Tphcm | TikTok,https://www.tiktok.com/discover/thpt-m%E1%BA%A1c-%C4%91%C4%A9nh-chi-tphcm,"12 hours ago ... giáo dục để trẻ biết yêu thương, triết lý giáo dục tại trường THPT Mạc ... Đại Học Cửu Long Bị Phốt · Thpt Fpt Long Biên · Phốt Đại Học Đông Á · Eteft Bị ...",phốt,03:00:44 3/9/2025
Phốt Hoang Hiệp Entertainment | TikTok,https://www.tiktok.com/discover/ph%E1%BB%91t-hoang-hi%E1%BB%87p-entertainment,10 hours ago ... Bốc phốt công ty Huyền phi lừa đảo mình có ai muốn như mình không ... NT: bất ngờ chưa mấy cưng #dienhycongluoc #dhcl #canlong #nguyanhlac #phohang ...,"lừa đảo, phốt",03:00:44 3/9/2025
Review Cao Đẳng Fpt Polytechnic Quận 12 | TikTok,https://www.tiktok.com/discover/review-cao-%C4%91%E1%BA%B3ng-fpt-polytechnic-qu%E1%BA%ADn-12,24 hours ago ... Đại Học Cửu Long Bị Phốt · Phốt Cao Đẳng Fpt Polytechnic · Lương Giảng Viên Đại Học Fpt · Thẻ Sinh Viên Đại Học Fpt · Phốt Đại Học Nguyễn Tất Thành · Thpt Fpt ...,phốt,11:00:44 3/9/2025
Chuyên Viên Tư Vấn Giáo Dục (Ocean Edu Quảng Ngãi),https://studentjob.vn/viec-lam/chuyen-vien-tu-van-giao-duc-ocean-edu-quang-ngai-job758103,"18 hours ago ... Báo cáo tin tuyển dụng: Nếu bạn thấy rằng tin tuyển dụng này không đúng hoặc có dấu hiệu lừa đảo, hãy phản ánh với chúng tôi. ... Đại học Cửu Long, Đại học ...",lừa đảo,11:00:44 3/9/2025
Sinh viên ở làng chú ý nhen #lamgidayta #sinhvien #daihoc ...,https://www.tiktok.com/@lamgidayta.channel/video/7545865047612869895,22 hours ago ... Phốt Cao Đẳng Fpt Polytechnic · Fpt Bị Lỗi Kết Nối Dịch Vụ · Lương Giảng Viên Đại Học Fpt ... Review Ký Túc Xá Đại Học Cửu Long · Phòng Trọ Mẫn Xá Yên Phong Bắc ...,phốt,19:00:44 4/9/2025
Công dân học tập,https://congdankhuyenhoc.vn/cong-dan-hoc-tap.htm,"4 hours ago ... Sau buổi học chuyên đề giáo dục kỹ năng với chủ đề: ""Thoát bẫy lừa đảo và bắt cóc online"" – nhiều học sinh trường Trung... Trường Đại học Cửu Long trao bằng tốt ...",lừa đảo,03:00:44 6/9/2025
Phốt Sinh Viên Văn Lang | TikTok,https://www.tiktok.com/discover/ph%E1%BB%91t-sinh-vi%C3%AAn-v%C4%83n-lang,"4 days ago ... Đại Học Cửu Long Bị Phốt · Balo Đại Học Văn Lang · Phốt Đỗ Huyền Thy Đại Học ... Theo quy định của Bộ Giáo dục và Đào tạo, sinh viên không được xúc phạm ...",phốt,19:39:44 10/9/2025