TieuDe,Link,NoiDung,TuKhoa,NgayPhatHien
Đại Học Cửu Long Bị Phốt | TikTok,https://www.tiktok.com/discover/%C4%91%E1%BA%A1i-h%E1%BB%8Dc-c%E1%BB%ADu-long-b%E1%BB%8B-ph%E1%BB%91t,15 giờ trước ... Nguyễn Nên. Ngày tư vấn tuyển sinh tại trường Đại Học Cửu Long *ĐHCL Xét Tuyển Học Bạ✓* #daihoccuulong,phốt,21:49:38 21/7/2025
04_29_M8WIN,http://dhcd.edu.vn/Rna/04_29_M8WIN,"2 ngày trước ... ... ĐH Cửu Long đã có trận đấu gặp Trường ĐH Cần Thơ trong khuôn khổ lượt trận ... lừa đảo qua tin nhắn Facebook, bằng cách ghép mặt nhờ AI.Theo Cục An ...",lừa đảo,21:49:38 21/7/2025
saowin lừa đảo,https://www.athleteinme.com/saowin-l%E1%BB%ABa-%C4%91%E1%BA%A3o,"10 thg 7, 2025 ... ... lừa đảo-Ở trận mở màn nhóm A, vòng loại khu vực Tây Nam bộ, giải ... ĐH Cửu Long qua đó đang nắm trong tay 1 điểm.Dù mới tham dự lần đầu nhưng ...",lừa đảo,21:49:38 21/7/2025
5566688_com,http://dhcd.edu.vn/5566688_com.xhtml,"2 ngày trước ... ... ĐH Cửu Long đã tổ chức thành công nhiều hội thảo khoa học quy mô trong ... lừa đảo chiếm đoạt tiền. ""Họ lập hẳn trang web vebaytet.com, tôi tìm hiểu ...","lừa đảo, chiếm đoạt",21:49:38 21/7/2025
tên-các-cầu-thủ-việt-nam,https://sinhvien.hlu.edu.vn/t%C3%AAn-c%C3%A1c-c%E1%BA%A7u-th%E1%BB%A7-vi%E1%BB%87t-nam.htm,"8 thg 7, 2025 ... ... ĐH Cửu Long đã có trận đấu gặp Trường ĐH Cần Thơ trong khuôn khổ lượt trận ... gian lận kiểm toán và các vi phạm khác.Trước vụ sáp nhập vào năm 2015 ...",gian lận,21:49:38 21/7/2025
soi_kèo_nhà_cái_2025_07_21,http://dhcd.edu.vn/soi_k%C3%A8o_nh%C3%A0_c%C3%A1i_2025_07_21.asp,19 giờ trước ... ... lừa đảo chiếm đoạt tài sản.Theo kết quả điều tra ban đầu của Phòng ... ĐH Cửu Long cũng dâng luôn ngôi đầu nhóm 1 cho đối thủ. Rất may ...,"lừa đảo, chiếm đoạt",03:02:38 22/7/2025
Link_vào_SV368_0721,https://www.honghafeed.com.vn/poker/Link_v%C3%A0o_SV368_0721.phtml,"7 days ago ... ... lừa đảo chiếm đoạt tài sản.Theo kết quả điều tra ban đầu, từ năm 2014, Hằng ... ĐH Cửu Long, Trường ĐH Nam Cần Thơ tại vòng bảng. Trận chung kết đội đã ...","lừa đảo, chiếm đoạt",17:55:42 28/7/2025
vietnam vs philippines,http://dhcd.edu.vn/Hot/vietnam%20vs%20philippines.phtml,7 days ago ... ... lừa đảo.Công an Hà Nội đề nghị người dân cảnh giác và tuyên truyền đến người ... ĐH Cửu Long.Dù được đánh giá yếu hơn nhưng Trường ĐH Cửu Long đã có ...,lừa đảo,17:55:42 28/7/2025
m88betwin,https://uhl.edu.vn/m88betwin.xhtml,"Jul 19, 2025 ... ... ĐH Cửu Long, Trường ĐH Nam Cần Thơ tại vòng bảng. Trận chung kết đội đã gặp ... lừa đảo “việc nhẹ, lương cao” không còn là chiêu trò mới, nhưng thủ ...",lừa đảo,17:55:42 28/7/2025
Swinburne Vietnam - Can Tho... - Swinburne Vietnam - Can Tho,https://www.facebook.com/photo.php?fbid=122139747530672940&id=61570188218019&set=a.122119773584672940,"Jun 30, 2025 ... ... lừa đảo học sinh, sinh viên và phụ huynh. Một số trang Facebook ... Trường Đại học Cửu Long tuyển sinh Cử nhân trực tuyến. 󱙶. Follow.",lừa đảo,17:55:42 28/7/2025
"Học 'Làm báo cùng Tuổi Trẻ', sinh viên Trường đại học Cửu Long ...",https://www.youtube.com/watch?v=g-AD2_MTdVs,"Jun 9, 2025 ... Học 'Làm báo cùng Tuổi Trẻ', sinh viên Trường đại học Cửu Long được tác nghiệp tại tuyến Metro số 1 ... 8:23. Go to channel · Cặp vợ chồng lừa đảo ...",lừa đảo,17:55:42 28/7/2025
"Học 'Làm báo cùng Tuổi Trẻ', sinh viên Trường đại học Cửu Long ...",https://tuoitre.vn/video/hoc-lam-bao-cung-tuoi-tre-sinh-vien-truong-dai-hoc-cuu-long-duoc-tac-nghiep-tai-tuyen-metro-so-1-182328.htm,"Jun 9, 2025 ... Học 'Làm báo cùng Tuổi Trẻ', sinh viên Trường đại học Cửu Long được tác nghiệp tại tuyến Metro số 1 ... Báo động lừa đảo nhắm vào học sinh, sinh ...",lừa đảo,17:55:42 28/7/2025
mpeg 5 set top box,https://www.qeza.gov.vn/wap/2025-06-05-mpeg%205%20set%20top%20box.xhtml,"Jun 4, 2025 ... ... ĐH Cửu Long xây dựng trong khuôn viên xanh mát với tổng diện ... lừa đảo chiếm đoạt tài sản. Các đối tượng tạo lập website, tài khoản ...","lừa đảo, chiếm đoạt",21:54:41 28/7/2025